{"append_count":2,"appended_selectors":["RECOVERY_OBSERVATION","RECOVERY_RESUMED"],"attempt_id":"sha256:6666666666666666666666666666666666666666666666666666666666666666","batch_sha256":"sha256:3333333333333333333333333333333333333333333333333333333333333333","classification":"RESUME_ORIGINAL_CANDIDATE","fencing_token":4,"first_receipt_id":"sha256:4444444444444444444444444444444444444444444444444444444444444444","first_receipt_sha256":"sha256:3333333333333333333333333333333333333333333333333333333333333333","first_sequence":17,"head_receipt_id":"sha256:1111111111111111111111111111111111111111111111111111111111111111","head_receipt_sha256":"sha256:2222222222222222222222222222222222222222222222222222222222222222","head_sequence":18,"lease_id":"sha256:5555555555555555555555555555555555555555555555555555555555555555","release_identity_id":"sha256:3d52af3a2bc6eb185a48465c8680d988a57f7fecf668313673ded1aaed3a59ab","resulting_state":"LEASED","resume_phase":"LEASED_RESTART","schema":"dpone.release-controller-recovery-decision-response.v1","schema_version":1,"tag":"v0.74.0","workflow_outcome":"CONTINUE"}